{
 "formatVersion": "1.0",
 "stage": "I-III",
 "entry": "open",
 "units": [
  {
   "id": "ew-u1",
   "title": {
    "pl": "Liczby i ich zapis"
   },
   "description": {
    "pl": "Czytamy, zapisujemy, porównujemy i układamy liczby."
   },
   "icon": "numbers",
   "lessons": [
    {
     "id": "ew-u1-01",
     "title": {
      "pl": "Zapisz liczbę cyframi"
     },
     "kind": "learn",
     "skill": "ew-write-number",
     "levels": [
      1,
      2,
      3,
      4
     ],
     "tasks": 5
    },
    {
     "id": "ew-u1-02",
     "title": {
      "pl": "Rzędy liczby"
     },
     "kind": "learn",
     "skill": "ew-place-value",
     "levels": [
      1,
      2,
      3
     ],
     "tasks": 10
    },
    {
     "id": "ew-u1-03",
     "title": {
      "pl": "Która liczba jest większa?"
     },
     "kind": "learn",
     "skill": "ew-compare",
     "levels": [
      1,
      2,
      3,
      4
     ],
     "tasks": 10
    },
    {
     "id": "ew-u1-04",
     "title": {
      "pl": "Ustaw liczby w kolejności"
     },
     "kind": "learn",
     "skill": "ew-order",
     "levels": [
      1,
      2,
      3,
      4
     ],
     "tasks": 10
    },
    {
     "id": "ew-u1-05",
     "title": {
      "pl": "Powtórka: liczby"
     },
     "kind": "review",
     "mix": [
      {
       "skill": "ew-write-number",
       "level": 1
      },
      {
       "skill": "ew-place-value",
       "level": 1
      },
      {
       "skill": "ew-compare",
       "level": 1
      },
      {
       "skill": "ew-order",
       "level": 1
      }
     ],
     "tasks": 12
    },
    {
     "id": "ew-u1-06",
     "title": {
      "pl": "Parzysta czy nieparzysta?"
     },
     "kind": "learn",
     "skill": "ew-odd-even",
     "levels": [
      1,
      2,
      3,
      4
     ],
     "tasks": 10
    },
    {
     "id": "ew-u1-07",
     "title": {
      "pl": "Liczenie co 2, co 5, co 10…"
     },
     "kind": "learn",
     "skill": "ew-skip-count",
     "levels": [
      1,
      2,
      3
     ],
     "tasks": 6
    },
    {
     "id": "ew-u1-08",
     "title": {
      "pl": "Skoki po osi liczbowej"
     },
     "kind": "learn",
     "skill": "ew-number-line-diff",
     "levels": [
      1,
      2,
      3
     ],
     "tasks": 10
    },
    {
     "id": "ew-u1-09",
     "title": {
      "pl": "Liczba na osi liczbowej"
     },
     "kind": "learn",
     "skill": "ew-number-line-read",
     "levels": [
      1,
      2,
      3
     ],
     "tasks": 4
    },
    {
     "id": "ew-u1-10",
     "title": {
      "pl": "Sprawdzian działu"
     },
     "kind": "checkpoint",
     "mix": [
      {
       "skill": "ew-write-number",
       "level": 2
      },
      {
       "skill": "ew-place-value",
       "level": 2
      },
      {
       "skill": "ew-compare",
       "level": 2
      },
      {
       "skill": "ew-order",
       "level": 2
      },
      {
       "skill": "ew-odd-even",
       "level": 2
      },
      {
       "skill": "ew-skip-count",
       "level": 2
      }
     ],
     "tasks": 15,
     "passRatio": 0.8
    }
   ],
   "testOut": {
    "tasks": 15,
    "passRatio": 0.9
   },
   "area": "I-III.1"
  },
  {
   "id": "ew-u2",
   "title": {
    "pl": "Dodawanie i odejmowanie"
   },
   "description": {
    "pl": "Rachunki w pamięci, także z przejściem przez dziesiątkę."
   },
   "icon": "plusminus",
   "lessons": [
    {
     "id": "ew-u2-01",
     "title": {
      "pl": "Dodawanie"
     },
     "kind": "learn",
     "skill": "ew-add",
     "levels": [
      1,
      2,
      3,
      4,
      5
     ],
     "tasks": 10
    },
    {
     "id": "ew-u2-02",
     "title": {
      "pl": "Odejmowanie"
     },
     "kind": "learn",
     "skill": "ew-sub",
     "levels": [
      1,
      2,
      3,
      4
     ],
     "tasks": 10
    },
    {
     "id": "ew-u2-03",
     "title": {
      "pl": "Powtórka: dodawanie i odejmowanie"
     },
     "kind": "review",
     "mix": [
      {
       "skill": "ew-add",
       "level": 1
      },
      {
       "skill": "ew-sub",
       "level": 1
      }
     ],
     "tasks": 12
    },
    {
     "id": "ew-u2-04",
     "title": {
      "pl": "Sprytne liczenie"
     },
     "kind": "learn",
     "skill": "ew-strategy",
     "levels": [
      1,
      2
     ],
     "tasks": 10
    },
    {
     "id": "ew-u2-05",
     "title": {
      "pl": "Brakująca liczba"
     },
     "kind": "learn",
     "skill": "ew-missing",
     "levels": [
      1,
      2,
      3,
      4
     ],
     "tasks": 10
    },
    {
     "id": "ew-u2-06",
     "title": {
      "pl": "Sprawdzamy działaniem odwrotnym"
     },
     "kind": "learn",
     "skill": "ew-inverse-check",
     "levels": [
      1,
      2
     ],
     "tasks": 10
    },
    {
     "id": "ew-u2-07",
     "title": {
      "pl": "Sprawdzian działu"
     },
     "kind": "checkpoint",
     "mix": [
      {
       "skill": "ew-add",
       "level": 2
      },
      {
       "skill": "ew-sub",
       "level": 2
      },
      {
       "skill": "ew-strategy",
       "level": 2
      },
      {
       "skill": "ew-missing",
       "level": 2
      },
      {
       "skill": "ew-inverse-check",
       "level": 2
      }
     ],
     "tasks": 15,
     "passRatio": 0.8
    }
   ],
   "testOut": {
    "tasks": 15,
    "passRatio": 0.9
   },
   "area": "I-III.1"
  },
  {
   "id": "ew-u3",
   "title": {
    "pl": "Mnożenie i dzielenie"
   },
   "description": {
    "pl": "Tabliczka mnożenia i dzielenie jako podział i mieszczenie."
   },
   "icon": "timesdiv",
   "lessons": [
    {
     "id": "ew-u3-01",
     "title": {
      "pl": "Tabliczka mnożenia"
     },
     "kind": "learn",
     "skill": "ew-mul-table",
     "levels": [
      1,
      2,
      3,
      4
     ],
     "tasks": 10
    },
    {
     "id": "ew-u3-02",
     "title": {
      "pl": "Dzielenie w zakresie tabliczki mnożenia"
     },
     "kind": "learn",
     "skill": "ew-div-table",
     "levels": [
      1,
      2,
      3,
      4
     ],
     "tasks": 10
    },
    {
     "id": "ew-u3-03",
     "title": {
      "pl": "Podział po równo i mieszczenie"
     },
     "kind": "learn",
     "skill": "ew-div-meaning",
     "levels": [
      1,
      2
     ],
     "tasks": 10
    },
    {
     "id": "ew-u3-04",
     "title": {
      "pl": "Podział czy mieszczenie?"
     },
     "kind": "learn",
     "skill": "ew-div-share-or-fit",
     "levels": [
      1
     ],
     "tasks": 10
    },
    {
     "id": "ew-u3-05",
     "title": {
      "pl": "Powtórka: mnożenie i dzielenie"
     },
     "kind": "review",
     "mix": [
      {
       "skill": "ew-mul-table",
       "level": 1
      },
      {
       "skill": "ew-div-table",
       "level": 1
      },
      {
       "skill": "ew-div-meaning",
       "level": 1
      }
     ],
     "tasks": 12
    },
    {
     "id": "ew-u3-06",
     "title": {
      "pl": "Mnożenie liczby dwucyfrowej"
     },
     "kind": "learn",
     "skill": "ew-mul-two-digit",
     "levels": [
      1,
      2
     ],
     "tasks": 10
    },
    {
     "id": "ew-u3-07",
     "title": {
      "pl": "Dzielenie liczby dwucyfrowej"
     },
     "kind": "learn",
     "skill": "ew-div-two-digit",
     "levels": [
      1,
      2
     ],
     "tasks": 10
    },
    {
     "id": "ew-u3-08",
     "title": {
      "pl": "Odkrywamy prawidłowości"
     },
     "kind": "learn",
     "skill": "ew-pattern-rule",
     "levels": [
      1,
      2,
      3,
      4
     ],
     "tasks": 10
    },
    {
     "id": "ew-u3-09",
     "title": {
      "pl": "Sprawdzian działu"
     },
     "kind": "checkpoint",
     "mix": [
      {
       "skill": "ew-mul-table",
       "level": 2
      },
      {
       "skill": "ew-div-table",
       "level": 2
      },
      {
       "skill": "ew-div-meaning",
       "level": 2
      },
      {
       "skill": "ew-mul-two-digit",
       "level": 2
      },
      {
       "skill": "ew-div-two-digit",
       "level": 2
      }
     ],
     "tasks": 15,
     "passRatio": 0.8
    }
   ],
   "testOut": {
    "tasks": 15,
    "passRatio": 0.9
   },
   "area": "I-III.1"
  },
  {
   "id": "ew-u4",
   "title": {
    "pl": "Znaki, liczby rzymskie i ułamki"
   },
   "description": {
    "pl": "Porównujemy wyrażenia, czytamy liczby rzymskie i poznajemy połowę, trzecią i czwartą część."
   },
   "icon": "fractions",
   "lessons": [
    {
     "id": "ew-u4-01",
     "title": {
      "pl": "Znaki <, > i ="
     },
     "kind": "learn",
     "skill": "ew-compare-expr",
     "levels": [
      1,
      2,
      3
     ],
     "tasks": 10
    },
    {
     "id": "ew-u4-02",
     "title": {
      "pl": "Przeczytaj liczbę rzymską"
     },
     "kind": "learn",
     "skill": "ew-roman-read",
     "levels": [
      1
     ],
     "tasks": 6
    },
    {
     "id": "ew-u4-03",
     "title": {
      "pl": "Zapisz liczbę po rzymsku"
     },
     "kind": "learn",
     "skill": "ew-roman",
     "levels": [
      1
     ],
     "tasks": 6
    },
    {
     "id": "ew-u4-04",
     "title": {
      "pl": "Ułamki o liczniku 1"
     },
     "kind": "learn",
     "skill": "ew-unit-fraction-name",
     "levels": [
      1,
      2
     ],
     "tasks": 6
    },
    {
     "id": "ew-u4-05",
     "title": {
      "pl": "Połowa, trzecia, czwarta część liczby"
     },
     "kind": "learn",
     "skill": "ew-unit-fraction-of",
     "levels": [
      1,
      2
     ],
     "tasks": 10
    },
    {
     "id": "ew-u4-06",
     "title": {
      "pl": "Sprawdzian działu"
     },
     "kind": "checkpoint",
     "mix": [
      {
       "skill": "ew-compare-expr",
       "level": 2
      },
      {
       "skill": "ew-roman-read",
       "level": 1
      },
      {
       "skill": "ew-roman",
       "level": 1
      },
      {
       "skill": "ew-unit-fraction-name",
       "level": 2
      },
      {
       "skill": "ew-unit-fraction-of",
       "level": 2
      }
     ],
     "tasks": 15,
     "passRatio": 0.8
    }
   ],
   "testOut": {
    "tasks": 15,
    "passRatio": 0.9
   },
   "area": "I-III.1"